Original Text,NULL
"Auburn, Alabama is located in the United States, where one of the ethnic groups is Asian Americans.","(""Auburn"", ""Auburn is a city located within the state of Alabama."", ""Alabama""); (""Alabama"", ""Alabama is a state located within the country of the United States."", ""United States""); (""Asian Americans"", ""Asian Americans are an ethnic group present in the United States."", ""United States"")"
"Auburn, Alabama is located in the United States, a country where one of the ethnic groups is Asian Americans.","(""Auburn"", ""Auburn is a city located within the state of Alabama"", ""Alabama""); (""Auburn"", ""Auburn is located in the United States"", ""United States""); (""Alabama"", ""Alabama is a state within the United States"", ""United States""); (""Asian Americans"", ""Asian Americans are an ethnic group in the United States"", ""United States"")"
"Auburn Alabama is in the United States, where one of the ethnic groups are Asian Americans.","(""Auburn Alabama"", ""Auburn Alabama is a city located within the United States."", ""United States""); (""Asian Americans"", ""Asian Americans are an ethnic group present in the United States."", ""United States"")"
"The area of Austin, Texas is 703.95km2 and the land area is 686km2.","(""Austin"", ""Austin is a city located in the state of Texas"", ""Texas"")"
"Austin, Texas has a total area of 703.95 sq km including a land area of 686 sq km.","(""Austin"", ""Austin is a city located within the state of Texas"", ""Texas"")"
"Austin is part of Travis County, Texas, is United States.","(""Austin"", ""Austin is part of Travis County"", ""Travis County""); (""Travis County"", ""Travis County is in Texas"", ""Texas""); (""Texas"", ""Texas is a state in the United States"", ""United States"")"
"Austin is part of Travis County, which is in Texas, United States.","(""Austin"", ""Austin is a city within Travis County."", ""Travis County""); (""Travis County"", ""Travis County is a county within the state of Texas."", ""Texas""); (""Texas"", ""Texas is a state within the United States."", ""United States"")"
"Austin is part of Travis County, in Texas, located within the country of the United States.","(""Austin"", ""Austin is located in Travis County"", ""Travis County""); (""Travis County"", ""Travis County is a part of Texas"", ""Texas""); (""Texas"", ""Texas is a state in the United States"", ""United States"")"
"Austin, Texas is located within the country of the United States and is led by the City Manager.","(""AUSTIN"", ""Austin is located within the state of Texas."", ""TEXAS""); (""AUSTIN"", ""Austin is located within the country of the United States."", ""UNITED STATES""); (""AUSTIN"", ""Austin is led by the City Manager."", ""CITY MANAGER"")"
"The leader of Austin, Texas, United States is the City Manager.","(""Austin"", ""Austin is a city located in the state of Texas"", ""Texas""); (""Texas"", ""Texas is a state in the United States"", ""United States""); (""Austin"", ""The City Manager is a leader in Austin"", ""City Manager""); (""City Manager"", ""The City Manager is a leader in Austin"", ""Austin"")"
"Austin, Texas is in the United States and is led by the City manager.","(""Austin"", ""Austin is a city in the state of Texas."", ""Texas""); (""Austin"", ""Austin is located in the United States."", ""United States""); (""Austin"", ""The city of Austin is led by the City Manager."", ""City Manager"")"
"Austin is located in Texas, in the country of the United States.","(""Austin"", ""Austin is a city located within the state of Texas."", ""Texas""); (""Texas"", ""Texas is a state within the country of the United States."", ""United States"")"
Austin is part of the state of Texas in the United States.,"(""Austin"", ""Austin is a city located within the state of Texas."", ""Texas""); (""Texas"", ""Texas is a state that is part of the United States."", ""United States"")"
"Austin is part of the state of Texas, in the United States.","(""Austin"", ""Austin is a city within the state of Texas."", ""Texas""); (""Texas"", ""Texas is a state within the United States."", ""United States"")"
"Attica is part of Indiana, where Indianapolis is the capital.","(""Attica"", ""Attica is a part of Indiana."", ""Indiana""); (""Indianapolis"", ""Indianapolis is the capital of Indiana."", ""Indiana"")"
Attica is part of the state of Indiana where the capital is Indianapolis.,"(""ATTICA"", ""Attica is part of the state of Indiana."", ""INDIANA""); (""INDIANAPOLIS"", ""Indianapolis is the capital of the state of Indiana."", ""INDIANA"")"
Ann Arbor is part of Michigan in the United States.,"(""Ann Arbor"", ""Ann Arbor is a city located within the state of Michigan."", ""Michigan""); (""Michigan"", ""Michigan is a state within the United States."", ""United States"")"
"Ann Arbor is part of Michigan, United States.","(""Ann Arbor"", ""Ann Arbor is a city located within the state of Michigan."", ""Michigan""); (""Michigan"", ""Michigan is a state within the United States."", ""United States"")"
Arlington is part of Texas when English is spoken.,"(""Arlington"", ""Arlington is a part of Texas"", ""Texas""); (""Texas"", ""English is spoken in Texas"", ""English"")"
"Arlington is part of the state of Texas, where English is used.","(""Arlington"", ""Arlington is a part of the state of Texas."", ""Texas""); (""Texas"", ""English is used in the state of Texas."", ""English"")"
Arlington is part of the state of Texas where the English language is spoken.,"(""Arlington"", ""Arlington is part of the state of Texas"", ""Texas""); (""Texas"", ""The English language is spoken in Texas"", ""English"")"
"Albuquerque is in New Mexico, in the United States, of which the occupants are Americans.","(""Albuquerque"", ""Albuquerque is a city located in New Mexico."", ""New Mexico""); (""New Mexico"", ""New Mexico is a state within the United States."", ""United States""); (""Americans"", ""Americans are the people or nationals from the United States."", ""United States"")"
"Albuquerque, New Mexico is located in the United States where the Americans are living.","(""Albuquerque"", ""Albuquerque is a city located within the state of New Mexico."", ""New Mexico""); (""New Mexico"", ""New Mexico is a state within the United States."", ""United States""); (""Americans"", ""Americans are people living in the United States."", ""United States"")"
"The United States is the location of Albuquerque, New Mexico and the inhabitants of the country are known as Americans.","(""United States"", ""Albuquerque is a city located in the United States."", ""Albuquerque""); (""Albuquerque"", ""Albuquerque is a city within the state of New Mexico."", ""New Mexico""); (""United States"", ""Americans are the inhabitants of the United States."", ""Americans"")"
"Akron, Ohio is part of the United States, where Asian Americans are an ethnic group.","(""Akron"", ""Akron is a city located in the state of Ohio."", ""Ohio""); (""Ohio"", ""Ohio is a state within the United States."", ""United States""); (""Asian Americans"", ""Asian Americans are an ethnic group within the United States."", ""United States"")"
Akron Ohio is part of the United States where one of the ethnic groups are Asian Americans.,"(""Akron"", ""Akron is a city located in Ohio."", ""Ohio""); (""Ohio"", ""Ohio is a state in the United States."", ""United States""); (""Asian Americans"", ""Asian Americans are an ethnic group residing in the United States."", ""United States"")"
"The United States include the ethnic group of Asian Americans and is the location of Akron, Ohio.","(""United States"", ""The United States is the location where the ethnic group Asian Americans reside."", ""Asian Americans""); (""Akron"", ""Akron is a city located within the state of Ohio."", ""Ohio""); (""United States"", ""Akron is a city located in the United States."", ""Akron""); (""United States"", ""Ohio is a state within the United States."", ""Ohio"")"
"Abilene, Texas is 524 above sea level, is 286.5 square kilometres large and has 429.9 people per square kilometre.","(""Abilene"", ""Abilene is a city located in the state of Texas"", ""Texas"")"
"Abilene, Texas; is 524m above sea level, has a total area of 286.5 sq km, and a population density of 429.9 inhabitants per square kilometre.","(""Abilene"", ""Abilene is a city located within the state of Texas."", ""Texas""); (""Abilene"", ""524 m is the elevation of Abilene above sea level."", ""524 m""); (""Abilene"", ""286.5 sq km is the total area of Abilene."", ""286.5 sq km""); (""Abilene"", ""429.9 inhabitants per square kilometre is the population density of Abilene."", ""429.9 inhabitants per square kilometre"")"
"At 524 metres above sea level, Abilene (Texas) has a total area of 286.5 square kilometres, and a population density of 429.9 inhabitants per square kilometre.","(""Abilene"", ""Abilene is a city located in the state of Texas"", ""Texas"")"
"Abilene is located in Texas in the United States. Washington, D. C. is the country's capital.","(""Abilene"", ""Abilene is a city located in the state of Texas."", ""Texas""); (""Texas"", ""Texas is a state within the United States."", ""United States""); (""Washington, D. C."", ""Washington, D. C. is the capital of the country."", ""Country's Capital""); (""United States"", ""The United States has Washington, D. C. as its capital."", ""Country's Capital"")"
"Abilene is part of Texas which is in the US, the capital of which is Washington DC.","(""Abilene"", ""Abilene is a part of Texas."", ""Texas""); (""Texas"", ""Texas is a part of the US."", ""US""); (""Washington DC"", ""Washington DC is the capital of the US."", ""US"")"
"Abilene is a part of Texas, in the United States, of which Washington, D.C. is the capital.","(""Abilene"", ""Abilene is a part of Texas."", ""Texas""); (""Texas"", ""Texas is a state in the United States."", ""United States""); (""Washington, D.C."", ""Washington, D.C. is the capital of the United States."", ""United States"")"
"Albany is a city in Dougherty County, Georgia in the United States where African Americans are an ethnic group.","(""Albany"", ""Albany is located in Dougherty County"", ""Dougherty County""); (""Dougherty County"", ""Dougherty County is a part of the state of Georgia"", ""Georgia""); (""Georgia"", ""Georgia is a state in the United States"", ""United States""); (""African Americans"", ""African Americans form an ethnic group in Albany"", ""Albany"")"
Albany is part of Dougherty County in Georgia in the United States where African Americans are one of the ethnic groups.,"(""Albany"", ""Albany is located in Dougherty County."", ""Dougherty County""); (""Dougherty County"", ""Dougherty County is located in Georgia."", ""Georgia""); (""Georgia"", ""Georgia is a state in the United States."", ""United States""); (""African Americans"", ""African Americans are one of the ethnic groups in the United States."", ""United States"")"
"The United States is home to an ethnic group called African Americans and is where you will find Albany, Dougherty County in Georgia.","(""Albany"", ""Albany is a city located in Dougherty County."", ""Dougherty County""); (""Dougherty County"", ""Dougherty County is located in the state of Georgia."", ""Georgia""); (""United States"", ""African Americans are an ethnic group residing in the United States."", ""African Americans""); (""Albany"", ""Albany is a city in the state of Georgia."", ""Georgia""); (""United States"", ""Georgia is a state within the United States."", ""Georgia"")"
"Albany is a city in Linn County and part of Benton County, Oregon in the U.S.","(""Albany"", ""Albany is located in Linn County."", ""Linn County""); (""Albany"", ""Albany is also a part of Benton County."", ""Benton County""); (""Linn County"", ""Linn County is located in the state of Oregon."", ""Oregon""); (""Benton County"", ""Benton County is located in the state of Oregon."", ""Oregon""); (""Oregon"", ""Oregon is a state within the U.S."", ""U.S."")"
"The city of Albany is part of both Linn County and Benton County, in Oregon, in the United States.","(""Albany"", ""Albany is part of Linn County"", ""Linn County""); (""Albany"", ""Albany is part of Benton County"", ""Benton County""); (""Albany"", ""Albany is located in the state of Oregon"", ""Oregon""); (""Oregon"", ""Oregon is a state in the United States"", ""United States"")"
"Part of Linn County, the city of Albany, is also part of Benton County, Oregon, in the U.S.","(""Albany"", ""Albany is part of Linn County"", ""Linn County""); (""Albany"", ""Albany is part of Benton County"", ""Benton County""); (""Linn County"", ""Linn County is located in Oregon"", ""Oregon""); (""Benton County"", ""Benton County is located in Oregon"", ""Oregon""); (""Oregon"", ""Oregon is a state in the U.S."", ""U.S."")"
"The New Mexico House of Representatives, led by Don Tripp, is the leader of Albuquerque, New Mexico in the United States.","(""New Mexico House of Representatives"", ""Don Tripp is the leader of the New Mexico House of Representatives"", ""Don Tripp""); (""Albuquerque"", ""Albuquerque is a city in the state of New Mexico"", ""New Mexico""); (""New Mexico"", ""New Mexico is a state within the United States"", ""United States"")"
"Albuquerque, New Mexico, U.S. is led by the New Mexico house of representatives, whose leader is Don Tripp.","(""Albuquerque"", ""Albuquerque is a city located in the state of New Mexico."", ""New Mexico""); (""New Mexico"", ""New Mexico is a state within the United States."", ""U.S.""); (""New Mexico House of Representatives"", ""The New Mexico House of Representatives is a legislative body within the state of New Mexico."", ""New Mexico""); (""Don Tripp"", ""Don Tripp is the leader of the New Mexico House of Representatives."", ""New Mexico House of Representatives"")"
"Albuquerque, New Mexico is in the United States and led by the New Mexico House of Representatives. Don Tripp leads that house.","(""ALBUQUERQUE"", ""ALBUQUERQUE is located in NEW MEXICO"", ""NEW MEXICO""); (""NEW MEXICO"", ""NEW MEXICO is a state in the UNITED STATES"", ""UNITED STATES""); (""NEW MEXICO HOUSE OF REPRESENTATIVES"", ""The NEW MEXICO HOUSE OF REPRESENTATIVES is a governing body of the state of NEW MEXICO"", ""NEW MEXICO""); (""DON TRIPP"", ""DON TRIPP leads the NEW MEXICO HOUSE OF REPRESENTATIVES"", ""NEW MEXICO HOUSE OF REPRESENTATIVES"")"
"Albuquerque, New Mexico is in the United States and led by the Albuquerque City Council whose leader is Richard J.Berry.","(""Albuquerque"", ""Albuquerque is located within the state of New Mexico."", ""New Mexico""); (""New Mexico"", ""New Mexico is a state within the United States."", ""United States""); (""Albuquerque City Council"", ""The Albuquerque City Council is the governing body of Albuquerque."", ""Albuquerque""); (""Richard J.Berry"", ""Richard J.Berry is the leader of the Albuquerque City Council."", ""Albuquerque City Council"")"
"Albuquerque in New Mexico, United States, is led by the Albuquerque City Council led by Richard J Berry.","(""Albuquerque"", ""Albuquerque is a city located in the state of New Mexico"", ""New Mexico""); (""Albuquerque"", ""Albuquerque is located in the United States"", ""United States""); (""Albuquerque City Council"", ""Richard J Berry is mentioned as leading the Albuquerque City Council"", ""Richard J Berry""); (""Albuquerque City Council"", ""The Albuquerque City Council is governing the city of Albuquerque"", ""Albuquerque"")"
"Albuquerque, New Mexico (United States), is led by the Albuquerque City Council, the leader of which is Richard J. Berry.","(""ALBUQUERQUE"", ""Albuquerque is a city located in New Mexico."", ""NEW MEXICO""); (""NEW MEXICO"", ""New Mexico is a state in the United States."", ""UNITED STATES""); (""ALBUQUERQUE CITY COUNCIL"", ""The Albuquerque City Council leads the city of Albuquerque."", ""ALBUQUERQUE""); (""RICHARD J. BERRY"", ""Richard J. Berry is the leader of the Albuquerque City Council."", ""ALBUQUERQUE CITY COUNCIL""); (""ALBUQUERQUE"", ""Albuquerque is a city located in the United States."", ""UNITED STATES"")"
"Alpharetta is part of the U.S. state, Georgia, where African Americans are one of the country's ethnic group.","(""Alpharetta"", ""Alpharetta is a city in the U.S. state of Georgia"", ""Georgia""); (""Georgia"", ""Georgia is a state in the United States"", ""United States""); (""African Americans"", ""African Americans are an ethnic group in the United States"", ""United States"")"
"The United States include the ethnic group of African Americans and is the location of Alpharetta, part of the state of Georgia.","(""African Americans"", ""African Americans are identified as an ethnic group within the United States."", ""United States""); (""Alpharetta"", ""Alpharetta is part of the state of Georgia."", ""Georgia""); (""Alpharetta"", ""Alpharetta is a location within the United States."", ""United States"")"
"Alpharetta, is part of Georgia, in the United States, where one of the ethnic groups is African Americans.","(""Alpharetta"", ""Alpharetta is a part of Georgia"", ""Georgia""); (""Georgia"", ""Georgia is a part of the United States"", ""United States""); (""African Americans"", ""African Americans are one of the ethnic groups in Alpharetta"", ""Alpharetta"")"
Amarillo is part of Potter County and Randall County in Texas in the U.S.,"(""Amarillo"", ""Amarillo is part of Potter County"", ""Potter County""); (""Amarillo"", ""Amarillo is part of Randall County"", ""Randall County""); (""Potter County"", ""Potter County is located in Texas"", ""Texas""); (""Randall County"", ""Randall County is located in Texas"", ""Texas""); (""Texas"", ""Texas is a state in the U.S."", ""U.S."")"
"Amarillo is part of Potter County and Randall County in Texas, United States.","(""Amarillo"", ""Amarillo is located within Potter County."", ""Potter County""); (""Amarillo"", ""Amarillo is located within Randall County."", ""Randall County""); (""Potter County"", ""Potter County is a part of Texas."", ""Texas""); (""Randall County"", ""Randall County is a part of Texas."", ""Texas""); (""Texas"", ""Texas is a state in the United States."", ""United States"")"
"Amarillo, Texas is located in the counties of Randall and Potter in the U.S.","(""Amarillo"", ""Amarillo is a city located within the state of Texas."", ""Texas""); (""Amarillo"", ""Amarillo is located in Randall County."", ""Randall""); (""Amarillo"", ""Amarillo is located in Potter County."", ""Potter""); (""Randall"", ""Randall is a county in the U.S."", ""U.S.""); (""Potter"", ""Potter is a county in the U.S."", ""U.S.""); (""Texas"", ""Texas is a state in the U.S."", ""U.S."")"
"Native Americans are an ethnic group in the United States, where you will find Amarillo, which is part of Potter County in Texas.","(""Native Americans"", ""Native Americans are an ethnic group in the United States"", ""United States""); (""Amarillo"", ""Amarillo is part of Potter County"", ""Potter County""); (""Potter County"", ""Potter County is located in Texas"", ""Texas""); (""Amarillo"", ""Amarillo is a city in Texas"", ""Texas"")"
"Amarillo is part of Potter County, Texas which is part of the U.S. where one of the ethnic groups are Native Americans.","(""Amarillo"", ""Amarillo is located in Potter County"", ""Potter County""); (""Potter County"", ""Potter County is located in Texas"", ""Texas""); (""Texas"", ""Texas is a state within the U.S."", ""U.S.""); (""Native Americans"", ""Native Americans are an ethnic group within the U.S."", ""U.S."")"
"Amarillo is part of Potter County, Texas, in the United States, where Native Americans are one of the ethnic groups.","(""Amarillo"", ""Amarillo is located in Potter County"", ""Potter County""); (""Potter County"", ""Potter County is located in Texas"", ""Texas""); (""Texas"", ""Texas is a state in the United States"", ""United States""); (""Amarillo"", ""Amarillo is part of Texas"", ""Texas""); (""Native Americans"", ""Native Americans are an ethnic group in the United States"", ""United States"")"
"The Native Americans are an ethnic group in the United States where Amarillo is located in Randall County, Texas.","(""Native Americans"", ""Native Americans are an ethnic group situated in the United States."", ""United States""); (""Amarillo"", ""Amarillo is a city located in Randall County."", ""Randall County""); (""Amarillo"", ""Amarillo is located in the state of Texas."", ""Texas""); (""Randall County"", ""Randall County is situated within the state of Texas."", ""Texas"")"
"Amarillo, Texas, is part of Randall County, Texas, United States, where Native Americans are one of the ethnic groups.","(""Amarillo"", ""Amarillo is a city located within the state of Texas"", ""Texas""); (""Randall County"", ""Randall County is a county within the state of Texas"", ""Texas""); (""Amarillo"", ""Amarillo is part of Randall County"", ""Randall County""); (""Randall County"", ""Randall County is located within the United States"", ""United States""); (""Texas"", ""Texas is a state within the United States"", ""United States""); (""Native Americans"", ""Native Americans are an ethnic group in the United States"", ""United States"")"
"Native Americans are one of the ethnic groups in the United States of America which is where Amarillo Texas, part of Randall County, is located.","(""Native Americans"", ""Native Americans are an ethnic group within the United States of America"", ""United States of America""); (""Amarillo"", ""Amarillo is a city located in the state of Texas"", ""Texas""); (""Amarillo"", ""Amarillo is part of Randall County"", ""Randall County""); (""Amarillo"", ""Amarillo is a city located in the United States of America"", ""United States of America""); (""Texas"", ""Texas is a state within the United States of America"", ""United States of America""); (""Randall County"", ""Randall County is a county within the state of Texas"", ""Texas"")"
"Orange County in California is part of the Greater Los Angeles area, where Anaheim is located in the United States.","(""Orange County"", ""Orange County is located in California."", ""California""); (""Orange County"", ""Orange County is part of the Greater Los Angeles area."", ""Greater Los Angeles""); (""Anaheim"", ""Anaheim is located in Orange County."", ""Orange County""); (""Greater Los Angeles"", ""Greater Los Angeles is located in California."", ""California""); (""California"", ""California is a state in the United States."", ""United States""); (""Anaheim"", ""Anaheim is located in the United States."", ""United States""); (""Greater Los Angeles"", ""Greater Los Angeles is located in the United States."", ""United States"")"
"Anaheim is a city in Orange County, which is part of the Greater Los Angeles area in California, United States.","(""Anaheim"", ""Anaheim is located in Orange County."", ""Orange County""); (""Orange County"", ""Orange County is part of the Greater Los Angeles area."", ""Greater Los Angeles""); (""Greater Los Angeles"", ""The Greater Los Angeles area is located in California."", ""California""); (""California"", ""California is a state within the United States."", ""United States"")"
Anaheim is a Californian city in Orange County. It is led by the United States House of Representatives.,"(""Anaheim"", ""Anaheim is located in Orange County."", ""Orange County""); (""Anaheim"", ""Anaheim is a city in California."", ""California""); (""Anaheim"", ""Anaheim is governed by the United States House of Representatives."", ""United States House of Representatives"")"
"The United States House of Representatives (in the United States), leads Anaheim, a city in Orange County which is part of California.","(""United States House of Representatives"", ""The United States House of Representatives is a governmental body within the United States."", ""United States""); (""Anaheim"", ""Anaheim is a city located within Orange County."", ""Orange County""); (""Orange County"", ""Orange County is a part of the state of California."", ""California"")"
"The United States House of Representatives leads Anaheim, which is part of Orange County, California.","(""Anaheim"", ""Anaheim is a city that is located in Orange County."", ""Orange County""); (""Orange County"", ""Orange County is a county located within the state of California."", ""California"")"
"Angola is part of Steuben County, Indiana in the United States, the country where Native Americans are an ethnic group.","(""Angola"", ""Angola is located in Steuben County."", ""Steuben County""); (""Steuben County"", ""Steuben County is part of Indiana."", ""Indiana""); (""Indiana"", ""Indiana is a state in the United States."", ""United States""); (""Native Americans"", ""Native Americans are an ethnic group in the United States."", ""United States"")"
"Angola, Indiana is in Steuben County, in the United States, where Native Americans, is one of the ethnic groups.","(""Angola"", ""Angola is a city located in the state of Indiana."", ""Indiana""); (""Angola"", ""Angola is located within Steuben County."", ""Steuben County""); (""Indiana"", ""Indiana is a state within the United States."", ""United States""); (""Steuben County"", ""Steuben County is a county within the state of Indiana."", ""Indiana""); (""Native Americans"", ""Native Americans are one of the ethnic groups in the United States."", ""United States"")"
"Native Americans are an ethnic group within the United States and Angola, Indiana is part of Steuben County, Indiana there.","(""Native Americans"", ""Native Americans are an ethnic group within the United States"", ""United States""); (""Angola, Indiana"", ""Angola, Indiana is part of Steuben County, Indiana"", ""Steuben County, Indiana"")"
