Original Text,NULL
"The area code of Abilene, in Texas, is 325.","(""ABILENE"", ""ABILENE is a city located within the state of TEXAS."", ""TEXAS""); (""ABILENE"", ""325 is the AREA_CODE assigned to the city of ABILENE."", ""325""); (""TEXAS"", ""325 is an AREA_CODE associated with locations in TEXAS, including ABILENE."", ""325"")"
"325 is the area code for Abilene, Texas.","(""325"", ""325 is the area code for the city of Abilene."", ""Abilene""); (""Abilene"", ""Abilene is a city located in the state of Texas."", ""Texas"")"
The area code for Abilene in Texas is 325.,"(""Abilene"", ""325 is the area code for the location Abilene"", ""325""); (""Abilene"", ""Abilene is a city located within Texas"", ""Texas"")"
Abilene is a part of Texas.,"(""Abilene"", ""Abilene is a part of Texas, indicating a geographical and jurisdictional relationship."", ""Texas"")"
"Abilene, Texas, is part of Texas.","(""Abilene"", ""Abilene is a city located within the state of Texas"", ""Texas"")"
"Albany, Georgia has a Mayor as leader.","(""Albany"", ""Albany is a city located in the state of Georgia"", ""Georgia""); (""Albany"", ""Albany has a Mayor who serves as its leader"", ""Mayor"")"
"Albany, Georgia is led by a Mayor.","(""Albany"", ""Albany is a city located in the state of Georgia."", ""Georgia""); (""Albany"", ""The Mayor is a leadership position associated with the city of Albany."", ""Mayor"")"
"The leader of Albany, Georgia is the Mayor.","(""Albany"", ""Albany is a city located within the state of Georgia."", ""Georgia""); (""Mayor"", ""The Mayor is the leader of the city of Albany."", ""Albany"")"
"Albany, Oregon has a total area of 45.97 square kilometres.","(""Albany"", ""Albany is a city located within the state of Oregon"", ""Oregon"")"
The total area of Albany Oregon is 45.97 Sq K.,"(""Albany Oregon"", ""The measurement represents the total area of Albany Oregon."", ""45.97 Sq K"")"
"The total area of Albany, Oregon is 45.97 sq kms.","(""Albany"", ""Albany is a city located within the state of Oregon"", ""Oregon"")"
"Albany, Oregon is in the U.S.","(""ALBANY"", ""Albany is a city located in the state of Oregon"", ""OREGON""); (""OREGON"", ""Oregon is a state in the U.S."", ""U.S."")"
"Albany, Oregon is located within the United States.","(""Albany"", ""Albany is a city located within the state of Oregon."", ""Oregon""); (""Oregon"", ""Oregon is a state within the United States."", ""United States"")"
"Albuquerque, New Mexico is led by the State Senate.","(""Albuquerque"", ""Albuquerque is a city located within the state of New Mexico."", ""New Mexico""); (""Albuquerque"", ""The State Senate is a governing body that has jurisdiction over Albuquerque."", ""State Senate""); (""New Mexico"", ""The State Senate is part of the government of the state of New Mexico."", ""State Senate"")"
"The Albuquerque City Council has a leadership role in Albuquerque, New Mexico.","(""Albuquerque City Council"", ""The Albuquerque City Council is a governing body within the city of Albuquerque."", ""Albuquerque""); (""Albuquerque"", ""Albuquerque is a city located within the state of New Mexico."", ""New Mexico"")"
Albuquerque in New Mexico is led by the Albuquerque City Council.,"(""Albuquerque"", ""Albuquerque is governed by the Albuquerque City Council."", ""Albuquerque City Council""); (""Albuquerque"", ""Albuquerque is a city located in the state of New Mexico."", ""New Mexico"")"
"Amarillo is in Texas, in the United States.","(""Amarillo"", ""Amarillo is located in Texas"", ""Texas""); (""Texas"", ""Texas is located in the United States"", ""United States"")"
"The United States is the home country to Amarillo, Texas.","(""Amarillo"", ""Amarillo is a city located within the state of Texas."", ""Texas""); (""United States"", ""Texas is a state within the United States."", ""Texas"")"
"Amarillo, Texas is located within the United States.","(""AMARILLO"", ""AMARILLO is a city located within TEXAS."", ""TEXAS""); (""TEXAS"", ""TEXAS is a state located within the UNITED STATES."", ""UNITED STATES"")"
Amarillo is part of Potter County in Texas.,"(""AMARILLO"", ""Amarillo is geographically located within Potter County."", ""POTTER COUNTY""); (""POTTER COUNTY"", ""Potter County is part of the state of Texas."", ""TEXAS"")"
"Amarillo is part of Potter County, Texas.","(""Amarillo"", ""Amarillo is a city located within Potter County."", ""Potter County""); (""Potter County"", ""Potter County is a county located within the state of Texas."", ""Texas""); (""Amarillo"", ""Amarillo is indirectly related to Texas as it is part of Potter County, which is in Texas."", ""Texas"")"
"Amarillo is in Texas, in the United States.","(""Amarillo"", ""Amarillo is a city located within the state of Texas."", ""Texas""); (""Texas"", ""Texas is a state located within the United States."", ""United States"")"
"Amarillo, Texas is part of the United States.","(""Amarillo"", ""Amarillo is a city located within the state of Texas"", ""Texas""); (""Texas"", ""Texas is a state within the United States"", ""United States"")"
"Amarillo, Texas, is part of the United States.","(""Amarillo"", ""Amarillo is a city located within the state of Texas."", ""Texas""); (""Texas"", ""Texas is a state that is part of the United States."", ""United States"")"
"Anaheim, in California, has the area code 657.","(""ANAHEIM"", ""ANAHEIM is a city located within the state of CALIFORNIA"", ""CALIFORNIA""); (""657"", ""657 is the area code associated with ANAHEIM"", ""ANAHEIM"")"
"The area code of Anaheim, California is 657.","(""657"", ""657 is the area code assigned to Anaheim"", ""Anaheim""); (""Anaheim"", ""Anaheim is a city located in California"", ""California"")"
"The area code for Anaheim, California, is 657.","(""657"", ""657 is the area code assigned to the location Anaheim."", ""Anaheim""); (""Anaheim"", ""Anaheim is a city located within the state of California."", ""California"")"
"Anderson, Indiana is part of Adams Fall Creek, Lafayette, Richland, Union.","(""Anderson"", ""Anderson is located in Indiana."", ""Indiana""); (""Indiana"", ""Indiana comprises several regions, including Adams."", ""Adams""); (""Indiana"", ""Indiana comprises several regions, including Fall Creek."", ""Fall Creek""); (""Indiana"", ""Indiana comprises several regions, including Lafayette."", ""Lafayette""); (""Indiana"", ""Indiana comprises several regions, including Richland."", ""Richland""); (""Indiana"", ""Indiana comprises several regions, including Union."", ""Union"")"
"Angola is in Pleasant Township which is part of Steuben County, in Indiana.","(""Angola"", ""Angola is located in Pleasant Township."", ""Pleasant Township""); (""Pleasant Township"", ""Pleasant Township is part of Steuben County."", ""Steuben County""); (""Steuben County"", ""Steuben County is located in Indiana."", ""Indiana"")"
"Angola, Indiana is part of Pleasant Township, which is in Steuben County.","(""Angola"", ""Angola is a city located within the state of Indiana"", ""Indiana""); (""Angola"", ""Angola is a part of Pleasant Township"", ""Pleasant Township""); (""Pleasant Township"", ""Pleasant Township is within Steuben County"", ""Steuben County"")"
"A City Administrator leads Ann Arbor, Michigan.","(""City Administrator"", ""The City Administrator is responsible for leading the city of Ann Arbor."", ""Ann Arbor""); (""Ann Arbor"", ""Ann Arbor is a city located within the state of Michigan."", ""Michigan"")"
The City Administrator leads Ann Arbor in Michigan.,"(""City Administrator"", ""The City Administrator is responsible for leading the city of Ann Arbor."", ""Ann Arbor""); (""Ann Arbor"", ""Ann Arbor is a city located within the state of Michigan."", ""Michigan"")"
"Mayor, is the title of the leader in Ann Arbor, Michigan.","(""Mayor"", ""The Mayor is the leader in Ann Arbor."", ""Ann Arbor""); (""Ann Arbor"", ""Ann Arbor is a city located in Michigan."", ""Michigan"")"
"Ann Arbor, Michigan is led by the Mayor.","(""Ann Arbor"", ""The Mayor leads the city of Ann Arbor."", ""Mayor""); (""Ann Arbor"", ""Ann Arbor is a city located within the state of Michigan."", ""Michigan"")"
"The leader title of Ann Arbor, Michigan, is Mayor.","(""Ann Arbor"", ""Ann Arbor is located in the state of Michigan."", ""Michigan""); (""Ann Arbor"", ""The leader title of Ann Arbor is Mayor."", ""Mayor"")"
"The city of Ann Arbor, Michigan, has a population of 1580.7 as per square kilometre.","(""Ann Arbor"", ""Ann Arbor is a city located in the state of Michigan"", ""Michigan"")"
"AnnArbor, Michigan has a population of 1580.7 peer square kilometer.",NULL
"The population density of Ann Arbor, Michigan is 1580.7 inhabitants per sq km.","(""Ann Arbor"", ""Ann Arbor is a city located within the state of Michigan."", ""Michigan"")"
"Antioch, CA is 13 above sea level.","(""Antioch"", ""Antioch is a city located in the state of California, abbreviated as CA."", ""CA"")"
"Antioch, California is 13.0 metres above sea level.","(""Antioch"", ""Antioch is a city located in the state of California"", ""California"")"
"Antioch, California is located at 13.0 above sea level.","(""Antioch"", ""Antioch is a city located within the state of California"", ""California"")"
"The leader title of Antioch, California, is California's 11th State Assembly district.","(""California"", ""Antioch is a city located in the state of California."", ""Antioch""); (""California's 11th State Assembly district"", ""Antioch is part of California's 11th State Assembly district."", ""Antioch"")"
The leader title of Antioch California is California's 11th State Assembly district.,"(""Antioch California"", ""Antioch California is part of the California's 11th State Assembly district."", ""11th State Assembly district""); (""California"", ""California's 11th State Assembly district is part of the state's government structure."", ""11th State Assembly district"")"
Arlington Texas is has an elevation of 184 above sea level.,"(""Arlington"", ""Arlington is a city located in the state of Texas"", ""Texas"")"
Arlington in Texas is located at 184.0 above sea level.,"(""Arlington"", ""Arlington is a city located within the state of Texas."", ""Texas"")"
"Atlantic County, New Jersey is located in the United States.","(""Atlantic County"", ""Atlantic County is located within the state of New Jersey"", ""New Jersey""); (""Atlantic County"", ""Atlantic County is part of the United States"", ""United States""); (""New Jersey"", ""New Jersey is a state in the United States"", ""United States"")"
Atlantic County in New Jersey is located in the United States.,"(""Atlantic County"", ""Atlantic County is a county located within the state of New Jersey."", ""New Jersey""); (""New Jersey"", ""New Jersey is a state located in the United States."", ""United States"")"
Attica is part of Fountain County Indiana.,"(""Attica"", ""Attica is a part of Fountain County"", ""Fountain County""); (""Fountain County"", ""Fountain County is located in Indiana"", ""Indiana"")"
"Attica, Indiana is in Fountain County, Indiana.","(""Attica"", ""Attica is a city located in Fountain County."", ""Fountain County""); (""Fountain County"", ""Fountain County is a county located in the state of Indiana."", ""Indiana""); (""Attica"", ""Attica is located within the state of Indiana."", ""Indiana"")"
Auburn is part of Alabama.,"(""Auburn"", ""Auburn is a city located within the state of Alabama."", ""Alabama"")"
Auburn is located in Alabama.,"(""AUBURN"", ""Auburn is a city located in the state of Alabama."", ""ALABAMA"")"
California is in the United States.,"(""California"", ""California is a state located within the United States."", ""United States"")"
California is in the U.S.,"(""California"", ""California is a state within the U.S."", ""U.S"")"
"Atlanta is the largest city of Fulton County, Georgia.","(""Atlanta"", ""Atlanta is located in Fulton County"", ""Fulton County""); (""Fulton County"", ""Fulton County is a part of the state of Georgia"", ""Georgia"")"
"Atlanta is the largest city in Fulton County, Georgia.","(""Atlanta"", ""Atlanta is located in Fulton County"", ""Fulton County""); (""Fulton County"", ""Fulton County is part of Georgia"", ""Georgia"")"
The state of Georgia is in the U.S.,"(""Georgia"", ""Georgia is a state located within the U.S."", ""U.S."")"
Georgia is in the country of United States.,"(""GEORGIA"", ""GEORGIA is in the country of UNITED STATES"", ""UNITED STATES"")"
The state of Georgia is located within the United States.,"(""Georgia"", ""Georgia is a state located within the United States."", ""United States"")"
Indianapolis is the capital of Indiana.,"(""Indianapolis"", ""Indianapolis is the capital of Indiana."", ""Indiana"")"
Lee County is in Alabama.,"(""LEE COUNTY"", ""LEE COUNTY is a county located within the state of ALABAMA."", ""ALABAMA"")"
Lee County is in the state of Alabama.,"(""Lee County"", ""Lee County is located in the state of Alabama."", ""Alabama"")"
Lee County is situated within the state of Alabama.,"(""Lee County"", ""Lee County is located within the state of Alabama"", ""Alabama"")"
Trenton is the capital of New Jersey.,"(""Trenton"", ""Trenton is the capital city of the state of New Jersey."", ""New Jersey"")"
The capital of the state of New Jersey is Trenton.,"(""New Jersey"", ""Trenton is the capital city of the state of New Jersey."", ""Trenton"")"
Potter County is in Texas.,"(""Potter County"", ""Potter County is a county located within the state of Texas."", ""Texas"")"
Potter County is in the State of Texas.,"(""Potter County"", ""Potter County is located within the State of Texas."", ""State of Texas"")"
"Tarrant County, Texas is situated in the United States.","(""TARRANT COUNTY"", ""Tarrant County is located within Texas."", ""TEXAS""); (""TEXAS"", ""Texas is a state within the United States."", ""UNITED STATES"")"
Tarrant County in Texas is in the U.S.,"(""Tarrant County"", ""Tarrant County is located in Texas."", ""Texas""); (""Texas"", ""Texas is a state within the U.S."", ""U.S."")"
"Tarrant County, Texas is located within the United States.","(""Tarrant County"", ""Tarrant County is a county located within the state of Texas."", ""Texas""); (""Texas"", ""Texas is a state located within the United States."", ""United States"")"
"Ann Arbor is the largest city in Washtenaw County, Michigan.","(""ANN ARBOR"", ""Ann Arbor is located in Washtenaw County"", ""WASHTENAW COUNTY""); (""ANN ARBOR"", ""Ann Arbor is a city in the state of Michigan"", ""MICHIGAN"")"
The largest town in Washtenaw county Michigan is Ann Arbor.,"(""Washtenaw"", ""Ann Arbor is a town located in Washtenaw county."", ""Ann Arbor""); (""Michigan"", ""Washtenaw is a county in the state of Michigan."", ""Washtenaw"")"
"The largest city in Washtenaw County, Michigan is Ann Arbor.","(""Washtenaw County"", ""Ann Arbor is a city within Washtenaw County"", ""Ann Arbor""); (""Michigan"", ""Washtenaw County is located in Michigan"", ""Washtenaw County""); (""Michigan"", ""Ann Arbor is located in Michigan"", ""Ann Arbor"")"
"Albany, Georgia is in the United States, home to a number of ethnic groups including, African Americans.","(""Albany"", ""Albany is a city located in the state of Georgia."", ""Georgia""); (""Albany"", ""Albany is a city in the United States."", ""United States""); (""African Americans"", ""African Americans are one of the ethnic groups residing in the United States."", ""United States"")"
"Albany, Georgia is part of the United States of America where one of the ethnic groups are the African Americans.","(""Albany"", ""Albany is a city located within the state of Georgia."", ""Georgia""); (""Georgia"", ""Georgia is a state that is part of the United States of America."", ""United States of America""); (""African Americans"", ""African Americans are an ethnic group residing in the United States of America."", ""United States of America"")"
"Albany, Georgia, is in the United States where African Americans are one of the ethnic groups.","(""Albany"", ""Albany is a city located in the state of Georgia."", ""Georgia""); (""Georgia"", ""Georgia is a state located within the United States."", ""United States""); (""African Americans"", ""African Americans are an ethnic group present in the United States."", ""United States"")"
Portland is the largest city in Oregon which also includes Albany.,"(""Portland"", ""Portland is located within Oregon"", ""Oregon""); (""Albany"", ""Albany is part of the state of Oregon"", ""Oregon"")"
"Portland is the largest city in Oregon, the state which is home to Albany.","(""Portland"", ""Portland is a city located within the state of Oregon."", ""Oregon""); (""Albany"", ""Albany is a city located within the state of Oregon."", ""Oregon"")"
Albany is a city in Oregon along with Portland which is the largest.,"(""Albany"", ""Albany is a city located in the state of Oregon."", ""Oregon""); (""Portland"", ""Portland is a city located in the state of Oregon."", ""Oregon"")"
"Alexandria, Indiana (total area 6.81 sq km), has a population density of 755.3 inhabitants per square kilometre.","(""Alexandria"", ""Alexandria is located in the state of Indiana"", ""Indiana""); (""Alexandria"", ""Alexandria has a defined total area"", ""Area""); (""Alexandria"", ""Alexandria has a specified population density"", ""Population Density"")"
"Alexandria, Indiana, covers an area of 6.81 sq kilometres and has a population density of 755.3 inhabitants per sq km.","(""Alexandria"", ""Alexandria is located in Indiana."", ""Indiana""); (""Alexandria"", ""The area of Alexandria is 6.81 sq kilometres."", ""6.81 sq kilometres""); (""Alexandria"", ""The population density of Alexandria is 755.3 inhabitants per sq km."", ""755.3 inhabitants per sq km"")"
"The population density of Alexandria, Indiana, is 755.3 (inhabitants per square kilometer) and it occupies 6.81 square kilometers.","(""ALEXANDRIA"", ""Alexandria is a city located in Indiana"", ""INDIANA""); (""ALEXANDRIA"", ""Alexandria has a population density statistic of 755.3 inhabitants per square kilometer"", ""POPULATION DENSITY""); (""ALEXANDRIA"", ""Alexandria occupies an area of 6.81 square kilometers"", ""AREA"")"
"Amarillo can be located in Potter County, Texas which is in the United States of America.","(""Amarillo"", ""Amarillo is located in Potter County"", ""Potter County""); (""Potter County"", ""Potter County is a part of Texas"", ""Texas""); (""Texas"", ""Texas is a state within the United States of America"", ""United States of America"")"
"Amarillo is part of Potter County, Texas, U.S.","(""Amarillo"", ""Amarillo is located within Potter County"", ""Potter County""); (""Potter County"", ""Potter County is located within Texas"", ""Texas""); (""Texas"", ""Texas is a state within the U.S."", ""U.S."")"
"Amarillo is located in Potter County, Texas in the United States of America.","(""Amarillo"", ""Amarillo is located in Potter County"", ""Potter County""); (""Potter County"", ""Potter County is located in Texas"", ""Texas""); (""Texas"", ""Texas is a state in the United States of America"", ""United States of America"")"
"Anaheim, California is situated at 48.0 above sea level and has a total area of 131.6 square kilometres.","(""Anaheim"", ""Anaheim is located in California"", ""California"")"
"Anaheim, California is situated at 48.0 above sea level and has a total area of 131.6 sq km.","(""Anaheim"", ""Anaheim is a city located in the state of California."", ""California""); (""Anaheim"", ""Anaheim is situated at a certain elevation above sea level."", ""Sea Level""); (""Anaheim"", ""Anaheim has a total area of 131.6 square kilometers."", ""131.6 sq km"")"
"Anderson is part of Anderson Township, Madison County, Indiana in the United States.",NULL
"Anderson, Indiana is part of Anderson Township, Madison County, Indiana, in the United States.","(""Anderson"", ""Anderson is located within the state of Indiana"", ""Indiana""); (""Anderson"", ""Anderson is part of Anderson Township"", ""Anderson Township""); (""Anderson Township"", ""Anderson Township is located within Madison County"", ""Madison County""); (""Madison County"", ""Madison County is located within the state of Indiana"", ""Indiana""); (""Indiana"", ""Indiana is a state in the United States"", ""United States"")"
"Anderson is part of the Anderson Township, Madison County in Indiana United States.","(""Anderson"", ""Anderson is part of Anderson Township"", ""Anderson Township""); (""Anderson Township"", ""Anderson Township is located in Madison County"", ""Madison County""); (""Madison County"", ""Madison County is located in Indiana"", ""Indiana""); (""Indiana"", ""Indiana is a state in the United States"", ""United States"")"
"Anderson, Indiana, is part of Fall Creek Township, Madison County Indiana, United States.","(""Anderson"", ""Anderson is part of Fall Creek Township"", ""Fall Creek Township""); (""Fall Creek Township"", ""Fall Creek Township is located in Madison County"", ""Madison County""); (""Madison County"", ""Madison County is located in Indiana"", ""Indiana""); (""Indiana"", ""Indiana is a state in the United States"", ""United States"")"
"Anderson is part of Fall Creek Township, Madison County, Indiana in the U.S.","(""Anderson"", ""Anderson is part of Fall Creek Township"", ""Fall Creek Township""); (""Fall Creek Township"", ""Fall Creek Township is part of Madison County"", ""Madison County""); (""Madison County"", ""Madison County is located in Indiana"", ""Indiana""); (""Indiana"", ""Indiana is a state in the U.S."", ""U.S."")"
"Anderson, is part of Fall Creek Township, Madison County, Indiana, in the U.S.","(""Anderson"", ""Anderson is part of Fall Creek Township"", ""Fall Creek Township""); (""Fall Creek Township"", ""Fall Creek Township is located in Madison County"", ""Madison County""); (""Madison County"", ""Madison County is located in Indiana"", ""Indiana""); (""Indiana"", ""Indiana is a state in the U.S."", ""U.S."")"
"Anderson is part of Union Township, Madison County, Indiana, United States.","(""Anderson"", ""Anderson is part of Union Township"", ""Union Township""); (""Union Township"", ""Union Township is part of Madison County"", ""Madison County""); (""Madison County"", ""Madison County is part of Indiana"", ""Indiana""); (""Indiana"", ""Indiana is part of the United States"", ""United States"")"
"Anderson is part of Union Township, Madison County, Indiana in the United States.","(""Anderson"", ""Anderson is a part of Union Township."", ""Union Township""); (""Union Township"", ""Union Township is a part of Madison County."", ""Madison County""); (""Madison County"", ""Madison County is a part of Indiana."", ""Indiana""); (""Indiana"", ""Indiana is a part of the United States."", ""United States"")"
"Ann Arbor, Michigan has a population of 1580.7 per square kilometre and a total area of 74.33 square kilometres.","(""Ann Arbor"", ""Ann Arbor is a city located within the state of Michigan."", ""Michigan"")"
The United States is the location of Atlanta and includes the African Americans among its ethnic groups.,"(""United States"", ""Atlanta is a city located in the United States"", ""Atlanta""); (""United States"", ""African Americans are an ethnic group within the United States"", ""African Americans"")"
The United States has the ethnic group of African Americans and is the location of Atlanta.,"(""United States"", ""The United States is the location where the ethnic group African Americans reside."", ""African Americans""); (""United States"", ""Atlanta is a city located within the United States."", ""Atlanta"")"
Atlanta is located in the United States where African Americans are an ethnic group.,"(""Atlanta"", ""Atlanta is a city located in the United States."", ""United States""); (""African Americans"", ""African Americans are an ethnic group present in the United States."", ""United States"")"
"Atlanta is part of Fulton County, Georgia, United States.","(""Atlanta"", ""Atlanta is located within Fulton County."", ""Fulton County""); (""Atlanta"", ""Atlanta is a city in the state of Georgia."", ""Georgia""); (""Georgia"", ""Georgia is a state within the United States."", ""United States"")"
"Atlanta is part of Fulton County, Georgia, US.","(""Atlanta"", ""Atlanta is located in Fulton County"", ""Fulton County""); (""Fulton County"", ""Fulton County is in Georgia"", ""Georgia""); (""Georgia"", ""Georgia is a state in the US"", ""US"")"
"Atlanta is part of Fulton County, Georgia U.S.","(""Atlanta"", ""Atlanta is located within Fulton County."", ""Fulton County""); (""Fulton County"", ""Fulton County is a part of Georgia."", ""Georgia""); (""Atlanta"", ""Atlanta is located in the state of Georgia."", ""Georgia"")"
Attica is located in the state of Indiana in the U.S.,"(""Attica"", ""Attica is a city located in the state of Indiana."", ""Indiana""); (""Indiana"", ""Indiana is a state within the United States of America (U.S.)."", ""U.S."")"
Attica is part of Indiana in the US.,"(""Attica"", ""Attica is a part of Indiana."", ""Indiana""); (""Indiana"", ""Indiana is a state in the US."", ""US"")"
Attica is part of Indiana in the United States.,"(""Attica"", ""Attica is located in Indiana"", ""Indiana""); (""Indiana"", ""Indiana is a state within the United States"", ""United States"")"
"Washington DC is the capital of the United States, where Auburn, Alabama is located.","(""Washington DC"", ""Washington DC is the capital of the United States"", ""United States""); (""Auburn"", ""Auburn is a city located in Alabama"", ""Alabama"")"
"Auburn Alabama is in the United States with Washington, D.C. as the capital of the U.S.","(""Auburn Alabama"", ""Auburn Alabama is a location within the United States."", ""United States""); (""Washington, D.C."", ""Washington, D.C. is the capital city of the U.S."", ""U.S."")"
